topic_id,topic_label
0,"llm, dataset, language model, network, human, reinforcement"
1,"llm, language model, dataset, training, text, human"
2,"logic, robot, ai, human, planning, agent, belief"
3,"graph, entity, ontology, kg, embed, embedding"
4,"image, network, gan, training, deep, segmentation, dataset"
5,"speech, emotion, music, audio, recognition, network, speaker"
6,"search, optimization, fuzzy, mutation, metaheuristic, price, station"
7,"attack, adversarial, anomaly, defense, detection, threat, vulnerability"
8,"game, agent, player, vote, election, voting, chess"
9,"llm, language model, human, reward, chatgpt, preference"
10,"causal, probabilistic, argumentation, variable, bayesian, network"
11,"user, explanation, recommendation, fairness, item, interpretable"
12,"privacy, dp, client, federate, private, network"
13,"cluster, text, clustering, nmf, topic, document"
14,"quantum, cognition, variational, contextuality"
