topic_id,topic_label
0,"language, dialogue, llms, language models, reasoning, qa, large language"
1,"learning, reinforcement learning, reinforcement, policy, rl, policies, imitation"
2,"clinical, medical, patients, health, delirium, patient, ehr"
3,"attacks, attack, anomaly, security, cyber, adversarial, backdoor"
4,"knowledge, graph, knowledge graphs, embedding, graphs, knowledge graph, kgs"
5,"multimodal, visual, video, image, modal, vision language, modalities"
6,"logic, belief, revision, asp, logics, maxsat, answer set"
7,"planning, robot, agent planning, agent, pomdp, multi agent, policies"
8,"speech, speaker, tts, asr, audio, speech recognition, automatic speech"
9,"ray, images, segmentation, image, dose, dsc, mri"
10,"bribery, votes, voting, frugal, game, cooperative, district"
11,"consciousness, intelligence, conscious, hiv, goal directed, cognitive, cell"
12,"probabilistic, bayesian, probabilistic programming, inference, bayesian networks, lifted, approximate inference"
13,"causal, causal structure, causal inference, structure learning, causality, causal discovery, jci"
14,"explanations, explainable, explainable recommendation, interpretable, interpretable machine, explanation, lime"
15,"game, games, chess, playing, ludii, pangea, starcraft"
16,"entity, word, word embeddings, languages, named entity, entity recognition, multilingual"
17,"dp, federated, privacy, federated learning, differentially private, clients, fl"
18,"gans, generative, images, image, gan, photographic, walls"
19,"pruning, quantization, bit, hardware, weight pruning, training, network"
20,"fuzzy, inconsistency, indices, decision, inconsistency indices, fuzzy set, pcm"
21,"sentiment, sentiment analysis, ratings, email, stories, narrative, creativity"
22,"chatgpt, genlangs, cww, eia, lexical diversity, zipf, zipf law"
23,"mutation, optimization, search, swarm, local search, simulated annealing, multiobjective"
24,"ai, ethical, moral, irrationalities, regulation, human, ethics"
25,"stations, routing, tsp, scheduling, vehicle routing, routing problem, problem"
26,"ontology, owl, ontologies, business, collaborative, dmn, mise"
27,"user, recommendation, item, items, recommendations, users, cold start"
28,"summarization, mds, document summarization, summaries, multi document, babi, mmr"
29,"price, pricing, bandits, reserve, bidding, arm, reserve price"
30,"emotion, emotion recognition, emotions, multimodal, recognition, wild, fusion"
31,"extraction, tables, relation extraction, el, scientific, entity, entities"
32,"rnns, keyboard, arnet, dropout, lstms, conformer, recurrent"
33,"fairness, fair, llms, healthcare, demographic, unfair predictions, fairness metrics"
34,"mathematics, mathematical, problems, mathematical reasoning, level mathematics, reasoning, minif2f"
35,"settlements, informal settlements, informal, satellite, dvs, satellite imagery, counting"
36,"privacy, mia, memorization, contextual privacy, notes, membership inference, membership"
37,"music, musical, melody, melodies, midinet, synchronisation, musecoco"
38,"clustering, rank, number clusters, clustering solutions, nmf, clusters, matrix"
39,"quantum, cognition, contextuality, quantum theory, quantum mass, human cognition, representation conceptual"
40,"argumentation, arguments, semantics, argumentative, argumentation semantics, akg, kabs"
41,"authorial, topic, morphosyntactic, morphology, legal, texts, morphological"
42,"agent, helpa, apps, clai, command, abduction, mobile apps"
43,"rlar, engagement, grading, graders, ya, ya ta, crowdsourcing"
44,"scrambled, revision, review, peer review, rem, rem ctx, ctx"
45,"preference, preference optimization, omni, reward, tso, rrm, omni rrm"
46,"patch, adversarial, adversarial patch, patches, stereo, attack, stereo matching"
47,"time series, forecasting, series, multivariate time, wind speed, speed forecasting, wind"
48,"robot, nlc, symbol, human robot, robotic, grounding, ser"
49,"quantum, variational quantum, quantum circuits, circuits, variational, ppd vqa, multiple quantum"
50,"continual, continual learning, rehearsal, forgetting, parameter regularization, cl, replay"
51,"scoring, batcheval, controlled generation, text evaluation, human settlement, settlement construction, analytic scoring"
52,"language, llms, language models, llm, performance, learning, training"
